cart_created_at,user_email,product_name
2024-11-18T14:20:00Z,vangogh@orsaymail.com,Starry Night Print;Sunflowers Ceramic Vase;Guernica Large Canvas
2024-11-18T15:10:00Z,renoir@orsaymail.com,Water Lilies Canvas;Renaissance Art Stickers Pack;Starry Night Print
2024-11-19T09:45:00Z,cezanne@orsaymail.com,Mont Sainte-Victoire Tote Bag;The Card Players Mug;Guernica Large Canvas
2024-11-19T10:30:00Z,rousseau@orsaymail.com,The Sleeping Gypsy Notebook;Impression Sunrise Poster;Sunflowers Ceramic Vase
2024-11-21T09:20:00Z,manet@orsaymail.com,Olympia Art Book;Guernica Large Canvas;Starry Night Print
2024-11-22T12:15:00Z,courbet@orsaymail.com,The Great Wave Puzzle;The Kiss Metal Poster;Impression Sunrise Poster
